软件实施工程师,4500,8000,1,广东及周边城市,大专,经验不限,5,慧策（掌上先机）,1000-5000人,"['互联网', '计算机软件']",民营公司,"['<p><strong style=\\""color: rgb(0, 102, 204);\\"">【工作地点】</strong></p><p>上海、广州、深圳、杭州、义务、苏州、北京、天津、长沙、武汉等多城市</p><p><br></p><p><strong style=\\""color: rgb(0, 102, 204);\\"">【岗位职责】</strong></p><p>1、根据项目经理要求按计划实施项目,做好项目实施中的协调及过程反馈；</p><p>2、了解电商，零售行业，及供应链管理流程，整理用户需求，解决实施过程中出现的问题；</p><p>3、指导用户进行基础数据准备；</p><p>4、对用户，管理员等进行操作培训；</p><p>5、根据公司要求，完成项目实施文档</p><p><br></p><p><strong style=\\""color: rgb(0, 102, 204);\\"">【任职资格】</strong></p><p>1、工科技术背景，工作经验不限，熟悉计算机操作及相关网络技术；</p><p>2、乐观开朗，具备较强的理解及表达能力，学习能力；</p><p>3、认真负责，工作积极主动，有责任心及团队合作精神；</p><p>4、能承受一定的工作压力，能接受高频出差。</p><p><br></p><p><strong style=\\""color: rgb(0, 102, 204);\\"">【薪酬福利】</strong></p><p>薪酬待遇 —— 基本工资+补贴+绩效奖金+每年 2 次晋升、调薪机会</p><p>员工福利 —— 五险一金+带薪培训+节假日福利+生日福利+团建活动+带薪年假</p><p>股票期权 —— 优秀员工可分配股票期权</p><p><br></p><p><strong style=\\""color: rgb(0, 102, 204);\\"">【招聘对象】</strong><strong style=\\""color: rgb(230, 0, 0); background-color: rgb(255, 255, 102);\\""> 2025届：专科、本科生</strong></p><p><br></p><p><strong style=\\""color: rgb(0, 102, 204);\\"">【职业通道】</strong> 岗前培训 →入职→大咖全程指导 → 转正 → 优异者加入高潜班 → 晋升管理层/专家组 （M/P 序列）</p><p><br></p><p><strong style=\\""color: rgb(0, 102, 204);\\"">【岗前培训】</strong></p><p><strong style=\\""color: rgb(0, 102, 204);\\"">岗前培训流程：</strong>线下宣讲-初试通过-线下培训（10 天时间）-线下考核-业务复试-offer 发放- 签三方</p><p><strong style=\\""color: rgb(0, 102, 204);\\""> 食宿安排：</strong>培训期间公司提供午餐、晚餐，非基地的学生提供住宿</p>']"
测试工程师,4000,4500,1,广州市白云区永平街集贤路109号6层627单元,大专,经验不限,2,九悦科技,少于50人,"['智能硬件', '互联网']",民营公司,['<p><strong>【岗位职责】</strong></p><p>1、负责公司产品的功能测试、性能测试及自动化测试工作；</p><p>2、编写及维护测试工作的相关文档；</p><p>3、参与需求评审，快速了解需求并提出改善意见，根据项目节奏制定合理的测试策略、测试计划和测试方法；</p><p>4、参与软件测试规范和技术的制定和改进。</p><p><br></p><p><strong>【任职要求】</strong></p><p>1、计算机相关专业，有1年及以上相关工作经验;2、精通测试用例设计，软件测试流程及方法，熟练APP及Web/h5测试；</p><p>3、熟悉Mysql数据库，掌握SQL语言；</p><p>4、熟悉Python、Java等至少1种编程语言，能编写测试脚本；</p><p>5、熟练使用Postman、Jmeter等工具进行接口测试、性能测试；</p><p>6、出色的推动能力、学习能力以及分析定位问题的能力。</p>']
大数据产品推广（客服）,4000,8000,1,广州从化区莱茵汇商业广场4楼,大专,经验不限,20,迅誉网络,100-500人,['互联网'],民营公司,"['<p><strong style=\\""color: rgb(0, 102, 204);\\"">岗位职责 </strong></p><p><span style=\\""color: rgb(89, 89, 89);\\"">1、根据公司自有系统做好大数据维护及管理工作。 </span></p><p><span style=\\""color: rgb(89, 89, 89);\\"">2、与客户进行沟通，了解客户需求，根据公司策划的活动对客户进行邀约。 </span></p><p><span style=\\""color: rgb(89, 89, 89);\\"">3、对潜在意向客户定期进行跟踪并回访，寻找机会推广并尽力完成公司下达的目标。 </span></p><p><span style=\\""color: rgb(89, 89, 89);\\"">4、维护与客户的良好关系，与合作客户保持频密的沟通，建立长期的合作关系。&nbsp;</span></p><p><br></p><p><strong style=\\""color: rgb(0, 102, 204);\\"">任职要求</strong></p><p>专业：不限</p><p>要求：知晓大数据挖掘和维护，会讲粤语、善于沟通、</p><p>服从管理、强烈的进取心</p><p><br></p><p><strong style=\\""color: rgb(0, 102, 204);\\"">薪资待遇</strong></p><p>底薪：4000元+绩效工资+提成（2000-3500元/单）。</p><p>月平均工资：6-15K/月</p><p><br></p><p><strong style=\\""color: rgb(0, 102, 204);\\"">实 习 生 福 利 待 遇 </strong></p><p><strong style=\\""color: rgb(0, 102, 204);\\"">（一）福利待遇： </strong></p><p>1.免费提供食宿（空调宿舍、免费中餐）。</p><p>2.购买广州社保、带薪年假、住房补贴。</p><p>3. 公司免费提供4-6人/间住宿，环境优雅。</p><p>4.享受节日福利、每周下午茶、年底旅游、年度联欢晚会。</p><p>5.定期组织主题员工活动：K歌赛、趣味运动会、联谊拓展活动等。</p><p>6.公司90%为95、00后，帅哥美女多、工作氛围轻松愉悦。</p><p>7.晋升通道宽广，公开透明，晋升路线：职员-资深员工-组长-主管-经理-总监。</p><p>8.所有的岗位一经录用，待遇优厚，我们会提供专业的职业培训及个人职业规划。</p><p><br></p><p><strong style=\\""color: rgb(0, 102, 204);\\"">（二）上班时间：</strong>9:30-13:00，14：00--19:30（月休4天）</p><p><br></p><p><strong style=\\""color: rgb(0, 102, 204);\\"">（三）上班地址：</strong>从化区从城大道2号莱茵汇商业中心4层</p><p><br></p><p><br></p><p><br></p><p><strong style=\\""color: rgb(255, 255, 255);\\"">烈的进取心</strong></p>']"
大数据标注,3000,5000,1,江苏省无锡市新吴区菱湖大道97号 ,大专,经验不限,0,澳鹏科技,100-500人,['计算机软件'],民营公司,"['<p><strong style=\\""color: rgb(0, 102, 204);\\"">【岗位职责】</strong></p><p class=\\""ql-align-justify\\"">1.&nbsp;为国际知名企业提供合规的人工智能算法训练数据；</p><p class=\\""ql-align-justify\\"">2.&nbsp;根据标注规则，进行文本、图片、语音、视频类的数据处理，包括2D/3D的图像分割、抓取或者结合雷达频谱图进行立体分析；</p><p class=\\""ql-align-justify\\"">3.&nbsp;公司要求完成的其他相关工作。</p><p><br></p><p><strong style=\\""color: rgb(0, 102, 204);\\"">【&nbsp;任职要求】</strong></p><p class=\\""ql-align-justify\\"">1.&nbsp;熟悉电脑操作、计算机、熟悉office 软件的基本使用。</p><p class=\\""ql-align-justify\\"">2.&nbsp;细致认真、有较强的沟通表达能力、学习能力强、态度端正、工作积极；</p><p><br></p><p><strong style=\\""color: rgb(0, 102, 204);\\"">【薪资待遇】</strong></p><p>底薪2500+绩效500-2000（工作3个月后综合3800-5000）</p><p><br></p><p><span style=\\""color: rgb(0, 102, 204);\\"">【</span><strong style=\\""color: rgb(0, 102, 204);\\"">住宿安排</strong><span style=\\""color: rgb(0, 102, 204);\\"">】</span></p><p><span style=\\""color: rgb(192, 0, 0);\\"">提供住宿4人间，优质宿舍</span></p>']"
数据标注,2000,4000,1,广州天河区广州小鹏汽车科技有限公司总部小鹏汽车,大专,经验不限,0,小鹏汽车,10000人以上,['汽车研发/制造'],上市公司,"['<p><strong style=\\""color: rgb(0, 102, 204); background-color: rgb(255, 255, 255);\\"">【工作内容】 </strong></p><p><span style=\\""color: rgb(34, 34, 34); background-color: rgb(255, 255, 255);\\""> 1、使用软件对车辆、人或道路信息进行标注</span></p><p><span style=\\""color: rgb(34, 34, 34); background-color: rgb(255, 255, 255);\\""> 2、对审核异常数据进行反馈，完成审核相关工作 </span></p><p><br></p><p><strong style=\\""color: rgb(0, 102, 204); background-color: rgb(255, 255, 255);\\"">【基本要求】 </strong></p><p><span style=\\""color: rgb(34, 34, 34); background-color: rgb(255, 255, 255);\\""> 1、专科及以上学历，必须为2025年毕业的实习生</span></p><p><br></p><p><strong style=\\""color: rgb(0, 102, 204); background-color: rgb(255, 255, 255);\\"">【工作时间】</strong><span style=\\""color: rgb(34, 34, 34); background-color: rgb(255, 255, 255);\\"">周一至周五 9：00-18：30，周末双休，法定节假日休息 </span></p><p><strong style=\\""color: rgb(0, 102, 204); background-color: rgb(255, 255, 255);\\"">【薪资待遇】</strong><span style=\\""color: rgb(34, 34, 34); background-color: rgb(255, 255, 255);\\"">2200，每三个月有一次晋升调整</span></p><p><strong style=\\""color: rgb(0, 102, 204); background-color: rgb(255, 255, 255);\\"">【其他福利】</strong><span style=\\""color: rgb(34, 34, 34); background-color: rgb(255, 255, 255);\\"">公司免费提供工作日中餐和晚餐，定期下午茶，聚餐。公司自营公寓免费提供住宿</span></p><p><strong style=\\""color: rgb(0, 102, 204); background-color: rgb(255, 255, 255);\\"">【上班地址】 </strong><span style=\\""color: rgb(34, 34, 34); background-color: rgb(255, 255, 255);\\"">广州黄埔区小鹏汽车智造创新中心小鹏汽车</span></p><p><br></p><p><strong style=\\""background-color: rgb(255, 255, 255); color: rgb(0, 102, 204);\\"">【岗位优势】 </strong></p><p><span style=\\""background-color: rgb(255, 255, 255); color: rgb(34, 34, 34);\\""> 上市公司，工作稳定</span></p><p><span style=\\""background-color: rgb(255, 255, 255); color: rgb(34, 34, 34);\\""> 周六日双休，无夜班</span></p><p><br></p><p><strong style=\\""color: rgb(230, 0, 0);\\"">注意：</strong><span style=\\""color: rgb(34, 34, 34); background-color: rgb(255, 255, 255);\\"">数据标注工作性质原因，可能带来高强度的工作压力、视觉疲劳以及重复性工作的单调乏味。</span></p><p><span style=\\""color: rgb(34, 34, 34); background-color: rgb(255, 255, 255);\\"">请先自行了解数据标注的具体工作是否为自身期望从事的工作再进行投递</span></p>']"
智能营销管培生,3500,10000,1,广州、武汉、成都、华北区域,大专,经验不限,20,探迹,1000-9999人,['互联网'],合资,"['<p><strong style=\\""color: rgb(0, 102, 204);\\"">【岗位职责】</strong></p><p>1、通过公司智能拓客云平台提供的资源和线索，通过电话沟通联系企业客户，与企业客户的CEO/销售负责人等KP（关键人物）沟通洽谈，促成对探迹产品的购买意向；</p><p>2、将意向客户转给客户顾问，协助客户顾问开展洽谈、远程演示和促进成单（产品及技术实力强，国内领先的SaaS智能销售云系统，目前已服务全国30000+家企业客户，快速帮助企业客户提升销售效率）；</p><p>3、主动学习公司给销售团队的赋能和课程，积极了解B端企业客户需求，学习系统应用和场景、市场趋势、行业信息、国家政策等，为个人成长和业绩达成积极提升。</p><p><br></p><p><strong style=\\""color: rgb(0, 102, 204);\\"">【任职要求】</strong></p><p>1、大专及以上学历，专业不限，商科类和信息科学等专业优先，有基本数智化运营管理思维；</p><p>2、热爱SaaS等人工智能产品，积极学习系统应用和场景、市场趋势、行业信息、国家政策等，</p><p>3、有较好的自驱力、学习能力和抗压能力，热爱销售，乐于挑战高薪，有销售经验的同学优先；</p><p><br></p><p><strong style=\\""color: rgb(0, 102, 204);\\"">【薪资计算示例】</strong></p><p>以平均客单价20000元计算，提成点7%-18%（按照成交客户多少计算）</p><p>月平均成交1个客户--月薪5000-6000元【3500（底薪）+1400-2400元（提成】</p><p>月平均成交2个客户--月薪7800-12500元【5000（底薪）+2800-7200元（提成）+现金激励（500-2000）】</p><p>月平均成交4个客户--月薪13600-26000元【8000（底薪）+5600-14400(提成）+现金激励（2000-4000）】</p>']"
新媒体运营（包食宿）,2500,3000,1,广州市荔湾区南岸路18号1至7楼后栋,大专,经验不限,20,广州天使儿童医院,100-500人,['医疗健康'],民营公司,"['<p><strong style=\\""color: rgb(68, 68, 68);\\"">岗位职责：</strong></p><p><span style=\\""color: rgb(68, 68, 68);\\"">1、负责医生短视频账号的运营工作， 结合医院战略定位制定运营策略; </span></p><p><span style=\\""color: rgb(68, 68, 68);\\"">2、结合医生科室属性策划内容，把控 视频内容方向，控制视频内容的创意和 品质; </span></p><p><span style=\\""color: rgb(68, 68, 68);\\"">3、根据平台运营逻辑分析数据，不断 优化内容方向，有效提高曝光量、播放量及粉丝量，对运营效果负责。</span></p><p><br></p><p><strong style=\\""color: rgb(68, 68, 68);\\"">任职要求</strong></p><p><span style=\\""color: rgb(68, 68, 68);\\"">1、会使用pr、剪映等剪辑软件（其中一 种）； </span></p><p><span style=\\""color: rgb(68, 68, 68);\\"">2、有良好的文字表达能力和审美观，扎 实的中文写作功底； </span></p><p><span style=\\""color: rgb(68, 68, 68);\\"">3、工作严谨，认真负责，有较强的团队 合作意识，良好协调能力和亲和力，踏 实肯干，能承受较强的工作压力。</span></p><p><br></p><p><em style=\\""color: rgb(68, 68, 68);\\"">福利待遇</em></p><p><strong style=\\""color: rgb(68, 68, 68);\\"">包食宿 ：</strong><span style=\\""color: rgb(68, 68, 68);\\"">公司有员工食堂，提 供一日三餐，提供员 工宿舍，让您吃得健 康，住得放心&nbsp;；</span></p><p><strong style=\\""color: rgb(68, 68, 68);\\"">员工培训成长 ：</strong><span style=\\""color: rgb(68, 68, 68);\\"">完善的部门培训计划， 让高校的学子能迅速 成长适应到工作当中。 </span></p><p><strong style=\\""color: rgb(68, 68, 68);\\"">高提成 ：</strong><span style=\\""color: rgb(68, 68, 68);\\"">提成高，待遇好，多 劳多得，不根据工龄 定薪资 ；</span></p><p><strong style=\\""color: rgb(68, 68, 68);\\"">五险 ：</strong><span style=\\""color: rgb(68, 68, 68);\\"">转正即购买五险，保 障员工基础福利 </span></p><p><strong style=\\""color: rgb(68, 68, 68);\\"">评比奖金：</strong><span style=\\""color: rgb(68, 68, 68);\\"">每月设立评比榜单， 设有额外的奖金，鼓励优秀人才；</span></p><p><br></p><p><br></p><p><strong style=\\""color: rgb(68, 68, 68);\\"">薪资架构 </strong></p><p><span style=\\""color: rgb(68, 68, 68);\\"">入职1-3个月薪资为:2500元/人/月+提成 </span></p><p><span style=\\""color: rgb(68, 68, 68);\\"">入职4-6个月薪资为:2800元/人/月+提成 </span></p><p><span style=\\""color: rgb(68, 68, 68);\\"">入职7-12个月薪资为:3000元/人/月+提成 </span></p><p><span style=\\""color: rgb(68, 68, 68);\\"">是否包吃：(包吃) 公司提供早、中、晚三餐 </span></p><p><span style=\\""color: rgb(68, 68, 68);\\"">是否包住: (包住) 住宿2-4人一间:水电平摊 </span></p><p><span style=\\""color: rgb(68, 68, 68);\\"">工作时间:早上8:30至下午17:30 </span></p><p><span style=\\""color: rgb(68, 68, 68);\\"">月休天数:月休4天 </span></p><p><span style=\\""color: rgb(68, 68, 68);\\"">节假曰福利:补贴、放假、旅游、礼物、游戏</span></p><p><br></p><p><span style=\\""color: rgb(68, 68, 68);\\"">\ufeff</span></p>']"
测试实习生,2500,5500,1,天津市西青区人工智能产业园7号楼4/7/8层,大专,经验不限,30, 中科创达,10000人以上,['互联网'],上市公司,"['<p><strong style=\\""color: rgb(0, 102, 204);\\"">【职位要求】</strong></p><p>1.本/专科学历，25届可长期实习者优先，</p><p>计算机或软件工程相关专业，学信网可查;</p><p>2.了解测试流程，能独立完成相关测试文档的编写工作，对功能则</p><p>试或某一领域的业务有较为深入的理解;</p><p>3.了解测试方法，了解python语句优先;</p><p>4.工作认真负责，良好的沟通能力和团队合作意识，良好的学习能</p><p>力和技术钻研能力;</p><p>5.有手机测试行业相关测试经验者优先。</p><p><br></p><p><strong style=\\""color: rgb(0, 102, 204);\\"">【薪资待遇】</strong><span style=\\""color: rgb(0, 102, 204);\\"">：</span>实习薪资：2500元；转正薪资：4000-5500+</p><p><br></p><p><strong>【上班时间】</strong>：弹性打卡，上 8:30-9:30，下 18:00-19:00，午休 1.5h。</p><p>晚 20:00 点后下班可享有误餐补贴 18 元/次</p><p>晚 22:30 点后下班可报销打车费</p><p>目前单休，周六上班算作调休（项目不忙时可安排双休）调休1:1兑换</p><p><br></p><p><strong style=\\""color: rgb(230, 0, 0);\\"">【信息安全】</strong><span style=\\""color: rgb(230, 0, 0);\\"">：</span>所做项目均处于开发未发布阶段，进出保密区不允许带任何通讯设备，出入不受限制。</p><p><br></p><p><strong style=\\""color: rgb(0, 102, 204);\\"">【住宿情况】</strong><span style=\\""color: rgb(0, 102, 204);\\"">：</span>实习生可提供住宿，6 人间 150/月。</p><p><br></p><p><strong style=\\""color: rgb(0, 102, 204);\\"">【工作地点】</strong><span style=\\""color: rgb(0, 102, 204);\\"">：天津市西青区人工智能产业园7号楼4/7/8层</span></p><p><br></p><p><br></p>']"
数据录入-包住（实习岗5人）,3000,5000,1,佛山市南海区桂城街道南海大道北59号中银大厦集约运营中心,大专,经验不限,5,维度数据,500-1000人,['数据服务'],民营公司,"['<p><strong style=\\""color: rgb(0, 102, 204);\\"">【岗位职责】</strong></p><p>1. 负责在系统上录入票据、凭证及客户资料等；</p><p>2. 检查凭证信息是否正确，工作就是录入，打字！</p><p><br></p><p><strong style=\\""color: rgb(0, 102, 204);\\"">【岗位要求】</strong></p><p>1. 实习生（需要做满3个月或以上）</p><p>2. 大专及以上学历</p><p>3. 熟悉计算机操作，熟悉中文数字录入，中文打字45/每分钟；,</p><p>4. 工作仔细认真，,有较强的责任心、品质良好、身体健康、无不良信用记录；</p><p><br></p><p><strong style=\\""color: rgb(0, 102, 204);\\"">【上班时间】</strong></p><p>1. 8:30-18:00；中午休息2小时</p><p>2. 周末双休，享国家法定节假日休息。</p><p><br></p><p><strong style=\\""color: rgb(0, 102, 204);\\"">【薪资福利】</strong></p><p>薪酬福利待遇 实习：2300底薪+绩效（按计件量），均薪：3000-5000元</p><p><br></p><p><strong style=\\""color: rgb(0, 102, 204);\\"">【其他福利】</strong></p><p>1. 实习生可提供实习证明，实习生可提供住宿</p><p>2. 工作环境整洁舒适，团队氛围好，工作时间稳定</p><p>3. 提供免费住宿</p><p>4. 有员工饭堂，早餐3元，午餐12元，晚餐6元</p><p><br></p><p><strong style=\\""color: rgb(0, 102, 204);\\"">【上班地址】</strong> 广州、<strong style=\\""color: rgb(0, 102, 204); background-color: rgb(255, 255, 0);\\"">佛山（办公场地为银行）</strong></p><p><br></p><p><strong style=\\""color: rgb(0, 102, 204);\\"">【注意事项】</strong></p><p>1.实习时长：因为银行工作的特殊性，实习时长必须为6个月及以</p><p><strong style=\\""background-color: rgb(255, 255, 0);\\"">2.办公地点：公司地址在佛山市南海区桂城街道南海大道北59号中银大厦集约运营中心。</strong></p>']"
智能座舱开发工程师,15000,25000,1,广州天河区小鹏汽车(智汇园区)A栋,大专,经验不限,0,小鹏汽车,10000人以上,['汽车研发/制造'],上市公司,"['<p><strong style=\\""background-color: rgb(255, 255, 255); color: rgb(0, 102, 204);\\"">【工作内容】 </strong></p><p><span style=\\""background-color: rgb(255, 255, 255); color: rgb(34, 34, 34);\\"">1、参与智能座舱业务软件的设计和开发工作。工作技术方向包括Android操作系统应用软件、系统业务开发；</span></p><p><span style=\\""background-color: rgb(255, 255, 255); color: rgb(34, 34, 34);\\"">2、根据产品需求，编写高质量的代码，实现智能座舱功能开发，包括座舱智能化、导航、音乐、Framework、SystemUI等相关功能开发；</span></p><p><span style=\\""background-color: rgb(255, 255, 255); color: rgb(34, 34, 34);\\"">3、和整车硬件联合，确保智能座舱软件在车载环境下的稳定性和性能；</span></p><p><span style=\\""background-color: rgb(255, 255, 255); color: rgb(34, 34, 34);\\"">4、关注行业动态和技术发展趋势，研究并引入新的技术和工具以提升智能座舱产品的用户体验和技术创新性；</span></p><p><br></p><p><strong style=\\""background-color: rgb(255, 255, 255); color: rgb(0, 102, 204);\\"">【基本要求】 </strong></p><p><span style=\\""background-color: rgb(255, 255, 255); color: rgb(34, 34, 34);\\"">  1、计算机、软件工程或相关专业硕士及以上学历；</span></p><p><span style=\\""background-color: rgb(255, 255, 255); color: rgb(34, 34, 34);\\"">2、具备扎实的计算机基础知识，熟悉数据结构、算法和操作系统原理；</span></p><p><span style=\\""background-color: rgb(255, 255, 255); color: rgb(34, 34, 34);\\"">3、熟悉Java/Kotlin等编程语言，了解C/C++，AR/VR，3D，AI相关技术者优先；</span></p><p><span style=\\""background-color: rgb(255, 255, 255); color: rgb(34, 34, 34);\\"">4、对车载电子系统、车联网有一定理解和兴趣，有智能座舱、车载信息系统开发实习经历者优先；</span></p><p><span style=\\""background-color: rgb(255, 255, 255); color: rgb(34, 34, 34);\\"">5、具备良好的问题分析解决能力，能够独立承担任务，同时具备优秀的团队协作精神；</span></p><p><span style=\\""background-color: rgb(255, 255, 255); color: rgb(34, 34, 34);\\"">6、积极主动，热爱学习新技术，对智能汽车行业充满热情；</span></p><p><br></p>']"
人工智能训练师,2300,5000,1,无锡市新吴区清源路20号大学科技园立业楼,大专,经验不限,30,澳鹏科技,100-500人,['计算机软件'],民营公司,"['<p><strong style=\\""color: rgb(0, 102, 204);\\"">【岗位要求及岗位职责】</strong></p><p>1.&nbsp;专科及以上学历，信息技术类相关专业；</p><p>2&nbsp;. 有较强的逻辑能力和文本理解能力，知道问题的核心提问点是什么，能快速理解问题点；</p><p>3. 细致认真、有较强的沟通表达能力、学习能力强、态度端正、工作积极；</p><p>4. 熟悉电脑操作、熟悉 office 软件的基本使用。</p><p><br></p><p><br></p><p><strong style=\\""color: rgb(0, 102, 204);\\"">【实习薪资】</strong></p><p>2300保底+绩效+住宿+双休</p><p><br></p><p><strong style=\\""color: rgb(0, 102, 204);\\"">【工作时间】</strong></p><p>8小时工作制，做5休2&nbsp;</p><p><br></p><p><br></p><p><strong style=\\""color: rgb(0, 102, 204);\\"">【其他福利】</strong></p><p>过节福利，免费住宿，住宿为4人间精装公寓</p>']"
